{
  "backendAddressPools": [
    {}
  ],
  "frontendIPConfigurations": [
    {}
  ],
  "inboundNatPools": [
    {}
  ],
  "inboundNatRules": [
    {}
  ],
  "loadBalancingRules": [
    {}
  ],
  "outboundRules": [
    {}
  ],
  "probes": [
    {}
  ],
  "provisioningState": "Succeeded",
  "resourceGuid": "example-string"
}